[
  {
    "Input": "Je reviendrai Mercredi",
    "Context": {
      "ReferenceDateTime": "2016-09-07T00:00:00"
    },
    "NotSupported": "python",
    "Results": [
      {
        "Text": "Mercredi",
        "Type": "date",
        "Value": {
          "Timex": "XXXX-WXX-3",
          "FutureResolution": {
            "date": "2016-09-07"
          },
          "PastResolution": {
            "date": "2016-08-31"
          }
        },
        "Start": 14,
        "Length": 8
      }
    ]
  },
  {
    "Input": "Je reviendrai en 15",
    "Context": {
      "ReferenceDateTime": "2016-11-07T00:00:00"
    },
    "NotSupported": "python",
    "Results": [
      {
        "Text": "15",
        "Type": "date",
        "Value": {
          "Timex": "XXXX-XX-15",
          "FutureResolution": {
            "date": "2016-11-15"
          },
          "PastResolution": {
            "date": "2016-10-15"
          }
        },
        "Start": 17,
        "Length": 2
      }
    ]
  },
  {
    "Input": "Je reviendrai Oct. 2",
    "Context": {
      "ReferenceDateTime": "2016-11-07T00:00:00"
    },
    "NotSupported": "python",
    "Results": [
      {
        "Text": "Oct. 2",
        "Type": "date",
        "Value": {
          "Timex": "XXXX-10-02",
          "FutureResolution": {
            "date": "2017-10-02"
          },
          "PastResolution": {
            "date": "2016-10-02"
          }
        },
        "Start": 14,
        "Length": 6
      }
    ]
  },
  {
    "Input": "Je reviendrai Oct-2",
    "Context": {
      "ReferenceDateTime": "2016-11-07T00:00:00"
    },
    "NotSupported": "python",
    "Results": [
      {
        "Text": "Oct-2",
        "Type": "date",
        "Value": {
          "Timex": "XXXX-10-02",
          "FutureResolution": {
            "date": "2017-10-02"
          },
          "PastResolution": {
            "date": "2016-10-02"
          }
        },
        "Start": 14,
        "Length": 5
      }
    ]
  },
  {
    "Input": "Je reviendrai Oct/2",
    "Context": {
      "ReferenceDateTime": "2016-11-07T00:00:00"
    },
    "NotSupported": "python",
    "Results": [
      {
        "Text": "Oct/2",
        "Type": "date",
        "Value": {
          "Timex": "XXXX-10-02",
          "FutureResolution": {
            "date": "2017-10-02"
          },
          "PastResolution": {
            "date": "2016-10-02"
          }
        },
        "Start": 14,
        "Length": 5
      }
    ]
  },
  {
    "Input": "Je reviendrai Octobre. 2",
    "Context": {
      "ReferenceDateTime": "2016-11-07T00:00:00"
    },
    "NotSupported": "python",
    "Results": [
      {
        "Text": "Octobre. 2",
        "Type": "date",
        "Value": {
          "Timex": "XXXX-10-02",
          "FutureResolution": {
            "date": "2017-10-02"
          },
          "PastResolution": {
            "date": "2016-10-02"
          }
        },
        "Start": 14,
        "Length": 10
      }
    ]
  },
  {
    "Input": "Je reviendrai Lundi 12 Janvier, 2016",
    "Context": {
      "ReferenceDateTime": "2016-11-07T00:00:00"
    },
    "NotSupported": "python",
    "Results": [
      {
        "Text": "Lundi 12 Janvier, 2016",
        "Type": "date",
        "Value": {
          "Timex": "2016-01-12",
          "FutureResolution": {
            "date": "2016-01-12"
          },
          "PastResolution": {
            "date": "2016-01-12"
          }
        },
        "Start": 14,
        "Length": 22
      }
    ]
  },
  {
    "Input": "Je reviendrai 02/22/2016",
    "Context": {
      "ReferenceDateTime": "2016-11-07T00:00:00"
    },
    "NotSupported": "python",
    "Results": [
      {
        "Text": "02/22/2016",
        "Type": "date",
        "Value": {
          "Timex": "2016-02-22",
          "FutureResolution": {
            "date": "2016-02-22"
          },
          "PastResolution": {
            "date": "2016-02-22"
          }
        },
        "Start": 14,
        "Length": 10
      }
    ]
  },
  {
    "Input": "Je reviendrai 21/04/2016",
    "Context": {
      "ReferenceDateTime": "2016-11-07T00:00:00"
    },
    "NotSupported": "python",
    "Results": [
      {
        "Text": "21/04/2016",
        "Type": "date",
        "Value": {
          "Timex": "2016-04-21",
          "FutureResolution": {
            "date": "2016-04-21"
          },
          "PastResolution": {
            "date": "2016-04-21"
          }
        },
        "Start": 14,
        "Length": 10
      }
    ]
  },
  {
    "Input": "Je reviendrai 21/04/16",
    "Context": {
      "ReferenceDateTime": "2016-11-07T00:00:00"
    },
    "NotSupported": "python",
    "Results": [
      {
        "Text": "21/04/16",
        "Type": "date",
        "Value": {
          "Timex": "2016-04-21",
          "FutureResolution": {
            "date": "2016-04-21"
          },
          "PastResolution": {
            "date": "2016-04-21"
          }
        },
        "Start": 14,
        "Length": 8
      }
    ]
  },
  {
    "Input": "Je reviendrai 21-04-2016",
    "Context": {
      "ReferenceDateTime": "2016-11-07T00:00:00"
    },
    "NotSupported": "python",
    "Results": [
      {
        "Text": "21-04-2016",
        "Type": "date",
        "Value": {
          "Timex": "2016-04-21",
          "FutureResolution": {
            "date": "2016-04-21"
          },
          "PastResolution": {
            "date": "2016-04-21"
          }
        },
        "Start": 14,
        "Length": 10
      }
    ]
  },
  {
    "Input": "Je reviendrai 22/04",
    "Context": {
      "ReferenceDateTime": "2016-11-07T00:00:00"
    },
    "NotSupported": "python",
    "Results": [
      {
        "Text": "22/04",
        "Type": "date",
        "Value": {
          "Timex": "XXXX-04-22",
          "FutureResolution": {
            "date": "2017-04-22"
          },
          "PastResolution": {
            "date": "2016-04-22"
          }
        },
        "Start": 14,
        "Length": 5
      }
    ]
  },
  {
    "Input": "Je reviendrai     22/4",
    "Context": {
      "ReferenceDateTime": "2016-11-07T00:00:00"
    },
    "NotSupported": "python",
    "Results": [
      {
        "Text": "22/4",
        "Type": "date",
        "Value": {
          "Timex": "XXXX-04-22",
          "FutureResolution": {
            "date": "2017-04-22"
          },
          "PastResolution": {
            "date": "2016-04-22"
          }
        },
        "Start": 18,
        "Length": 4
      }
    ]
  },
  {
    "Input": "Je reviendrai 2015/08/12",
    "Context": {
      "ReferenceDateTime": "2016-11-07T00:00:00"
    },
    "NotSupported": "python",
    "Results": [
      {
        "Text": "2015/08/12",
        "Type": "date",
        "Value": {
          "Timex": "2015-08-12",
          "FutureResolution": {
            "date": "2015-08-12"
          },
          "PastResolution": {
            "date": "2015-08-12"
          }
        },
        "Start": 14,
        "Length": 10
      }
    ]
  },
  {
    "Input": "Je reviendrai 12/08,2015",
    "Context": {
      "ReferenceDateTime": "2016-11-07T00:00:00"
    },
    "NotSupported": "python",
    "Results": [
      {
        "Text": "12/08,2015",
        "Type": "date",
        "Value": {
          "Timex": "2015-08-12",
          "FutureResolution": {
            "date": "2015-08-12"
          },
          "PastResolution": {
            "date": "2015-08-12"
          }
        },
        "Start": 14,
        "Length": 10
      }
    ]
  },
  {
    "Input": "Je reviendrai 12/08,15",
    "Context": {
      "ReferenceDateTime": "2016-11-07T00:00:00"
    },
    "NotSupported": "python",
    "Results": [
      {
        "Text": "12/08,15",
        "Type": "date",
        "Value": {
          "Timex": "2015-08-12",
          "FutureResolution": {
            "date": "2015-08-12"
          },
          "PastResolution": {
            "date": "2015-08-12"
          }
        },
        "Start": 14,
        "Length": 8
      }
    ]
  },
  {
    "Input": "Je reviendrai 1 Jan",
    "Context": {
      "ReferenceDateTime": "2016-11-07T00:00:00"
    },
    "NotSupported": "python",
    "Results": [
      {
        "Text": "1 Jan",
        "Type": "date",
        "Value": {
          "Timex": "XXXX-01-01",
          "FutureResolution": {
            "date": "2017-01-01"
          },
          "PastResolution": {
            "date": "2016-01-01"
          }
        },
        "Start": 14,
        "Length": 5
      }
    ]
  },
  {
    "Input": "Je reviendrai Jan-1",
    "Context": {
      "ReferenceDateTime": "2016-11-07T00:00:00"
    },
    "NotSupported": "python",
    "Results": [
      {
        "Text": "Jan-1",
        "Type": "date",
        "Value": {
          "Timex": "XXXX-01-01",
          "FutureResolution": {
            "date": "2017-01-01"
          },
          "PastResolution": {
            "date": "2016-01-01"
          }
        },
        "Start": 14,
        "Length": 5
      }
    ]
  },
  {
    "Input": "Je reviendrai Mer, 22 Janv.",
    "Context": {
      "ReferenceDateTime": "2016-11-07T00:00:00"
    },
    "NotSupported": "python",
    "Results": [
      {
        "Text": "Mer, 22 Janv",
        "Type": "date",
        "Value": {
          "Timex": "XXXX-01-22",
          "FutureResolution": {
            "date": "2017-01-22"
          },
          "PastResolution": {
            "date": "2016-01-22"
          }
        },
        "Start": 14,
        "Length": 12
      }
    ]
  },
  {
    "Input": "Je reviendrai Mai vingt et un",
    "Context": {
      "ReferenceDateTime": "2016-11-07T00:00:00"
    },
    "NotSupported": "python",
    "Results": [
      {
        "Text": "Mai vingt et un",
        "Type": "date",
        "Value": {
          "Timex": "XXXX-05-21",
          "FutureResolution": {
            "date": "2017-05-21"
          },
          "PastResolution": {
            "date": "2016-05-21"
          }
        },
        "Start": 14,
        "Length": 15
      }
    ]
  },
  {
    "Input": "Je reviendrai seconde de Aout",
    "Context": {
      "ReferenceDateTime": "2016-11-07T00:00:00"
    },
    "NotSupported": "python",
    "Results": [
      {
        "Text": "seconde de Aout",
        "Type": "date",
        "Value": {
          "Timex": "XXXX-08-02",
          "FutureResolution": {
            "date": "2017-08-02"
          },
          "PastResolution": {
            "date": "2016-08-02"
          }
        },
        "Start": 14,
        "Length": 15
      }
    ]
  },
  {
    "Input": "Je reviendrai 22 Juin",
    "Context": {
      "ReferenceDateTime": "2016-11-07T00:00:00"
    },
    "NotSupported": "python",
    "Results": [
      {
        "Text": "22 Juin",
        "Type": "date",
        "Value": {
          "Timex": "XXXX-06-22",
          "FutureResolution": {
            "date": "2017-06-22"
          },
          "PastResolution": {
            "date": "2016-06-22"
          }
        },
        "Start": 14,
        "Length": 7
      }
    ]
  },
  {
    "Input": "Je reviendrai Vendredi",
    "Context": {
      "ReferenceDateTime": "2016-11-07T00:00:00"
    },
    "NotSupported": "python",
    "Results": [
      {
        "Text": "Vendredi",
        "Type": "date",
        "Value": {
          "Timex": "XXXX-WXX-5",
          "FutureResolution": {
            "date": "2016-11-11"
          },
          "PastResolution": {
            "date": "2016-11-04"
          }
        },
        "Start": 14,
        "Length": 8
      }
    ]
  },
  {
    "Input": "Je reviendrai |ven",
    "Context": {
      "ReferenceDateTime": "2016-11-07T00:00:00"
    },
    "NotSupported": "python",
    "Results": [
      {
        "Text": "ven",
        "Type": "date",
        "Value": {
          "Timex": "XXXX-WXX-5",
          "FutureResolution": {
            "date": "2016-11-11"
          },
          "PastResolution": {
            "date": "2016-11-04"
          }
        },
        "Start": 15,
        "Length": 3
      }
    ]
  },
  {
    "Input": "Je reviendrai |Vendredi",
    "Context": {
      "ReferenceDateTime": "2016-11-07T00:00:00"
    },
    "NotSupported": "python",
    "Results": [
      {
        "Text": "Vendredi",
        "Type": "date",
        "Value": {
          "Timex": "XXXX-WXX-5",
          "FutureResolution": {
            "date": "2016-11-11"
          },
          "PastResolution": {
            "date": "2016-11-04"
          }
        },
        "Start": 15,
        "Length": 8
      }
    ]
  },
  {
    "Input": "Je reviendrai aujourd'hui",
    "Context": {
      "ReferenceDateTime": "2016-11-07T00:00:00"
    },
    "NotSupported": "python",
    "Results": [
      {
        "Text": "aujourd'hui",
        "Type": "date",
        "Value": {
          "Timex": "2016-11-07",
          "FutureResolution": {
            "date": "2016-11-07"
          },
          "PastResolution": {
            "date": "2016-11-07"
          }
        },
        "Start": 14,
        "Length": 11
      }
    ]
  },
  {
    "Input": "Je reviendrai lendemain",
    "Context": {
      "ReferenceDateTime": "2016-11-07T00:00:00"
    },
    "NotSupported": "python",
    "Results": [
      {
        "Text": "lendemain",
        "Type": "date",
        "Value": {
          "Timex": "2016-11-08",
          "FutureResolution": {
            "date": "2016-11-08"
          },
          "PastResolution": {
            "date": "2016-11-08"
          }
        },
        "Start": 14,
        "Length": 9
      }
    ]
  },
  {
    "Input": "Je reviens hier",
    "Context": {
      "ReferenceDateTime": "2016-11-07T00:00:00"
    },
    "NotSupported": "python",
    "Results": [
      {
        "Text": "hier",
        "Type": "date",
        "Value": {
          "Timex": "2016-11-06",
          "FutureResolution": {
            "date": "2016-11-06"
          },
          "PastResolution": {
            "date": "2016-11-06"
          }
        },
        "Start": 11,
        "Length": 4
      }
    ]
  },
  {
    "Input": "je reviendrai avant hier",
    "Context": {
      "ReferenceDateTime": "2016-11-07T00:00:00"
    },
    "NotSupported": "python",
    "Results": [
      {
        "Text": "avant hier",
        "Type": "date",
        "Value": {
          "Timex": "2016-11-05",
          "FutureResolution": {
            "date": "2016-11-05"
          },
          "PastResolution": {
            "date": "2016-11-05"
          }
        },
        "Start": 14,
        "Length": 10
      }
    ]
  },
  {
    "Input": "le apres-demain",
    "Context": {
      "ReferenceDateTime": "2016-11-07T00:00:00"
    },
    "NotSupported": "python",
    "Results": [
      {
        "Text": "apres-demain",
        "Type": "date",
        "Value": {
          "Timex": "2016-11-07",
          "FutureResolution": {
            "date": "2016-11-07"
          },
          "PastResolution": {
            "date": "2016-11-07"
          }
        },
        "Start": 3,
        "Length": 12
      }
    ]
  },
  {
    "Input": "Je reviendrai cette vendredi",
    "Context": {
      "ReferenceDateTime": "2016-11-07T00:00:00"
    },
    "NotSupported": "python",
    "Results": [
      {
        "Text": "cette vendredi",
        "Type": "date",
        "Value": {
          "Timex": "2016-11-11",
          "FutureResolution": {
            "date": "2016-11-11"
          },
          "PastResolution": {
            "date": "2016-11-11"
          }
        },
        "Start": 14,
        "Length": 14
      }
    ]
  },
  {
    "Input": "Je reviendrai dimanche prochain",
    "Context": {
      "ReferenceDateTime": "2016-11-07T00:00:00"
    },
    "NotSupported": "python",
    "Results": [
      {
        "Text": "dimanche prochain",
        "Type": "date",
        "Value": {
          "Timex": "2016-11-20",
          "FutureResolution": {
            "date": "2016-11-20"
          },
          "PastResolution": {
            "date": "2016-11-20"
          }
        },
        "Start": 14,
        "Length": 17
      }
    ]
  },
  {
    "Input": "Je reviendrai dimanche dernier",
    "Context": {
      "ReferenceDateTime": "2016-11-07T00:00:00"
    },
    "NotSupported": "python",
    "Results": [
      {
        "Text": "dimanche dernier",
        "Type": "date",
        "Value": {
          "Timex": "2016-11-06",
          "FutureResolution": {
            "date": "2016-11-06"
          },
          "PastResolution": {
            "date": "2016-11-06"
          }
        },
        "Start": 14,
        "Length": 16
      }
    ]
  },
  {
    "Input": "Je reviendrai vendredi cette semaine",
    "Context": {
      "ReferenceDateTime": "2016-11-07T00:00:00"
    },
    "NotSupported": "python",
    "Results": [
      {
        "Text": "vendredi cette semaine",
        "Type": "date",
        "Value": {
          "Timex": "2016-11-11",
          "FutureResolution": {
            "date": "2016-11-11"
          },
          "PastResolution": {
            "date": "2016-11-11"
          }
        },
        "Start": 14,
        "Length": 22
      }
    ]
  },
  {
    "Input": "Je reviendrai dimanche la semaine dernier",
    "Context": {
      "ReferenceDateTime": "2016-11-07T00:00:00"
    },
    "NotSupported": "python",
    "Results": [
      {
        "Text": "dimanche la semaine dernier",
        "Type": "date",
        "Value": {
          "Timex": "2016-11-06",
          "FutureResolution": {
            "date": "2016-11-06"
          },
          "PastResolution": {
            "date": "2016-11-06"
          }
        },
        "Start": 14,
        "Length": 27
      }
    ]
  },
  {
    "Input": "Je reviendrai 15 Juin 2016",
    "Context": {
      "ReferenceDateTime": "2016-11-07T00:00:00"
    },
    "NotSupported": "python",
    "Results": [
      {
        "Text": "15 Juin 2016",
        "Type": "date",
        "Value": {
          "Timex": "2016-06-15",
          "FutureResolution": {
            "date": "2016-06-15"
          },
          "PastResolution": {
            "date": "2016-06-15"
          }
        },
        "Start": 14,
        "Length": 12
      }
    ]
  },
  {
    "Input": "Je reviendrai premier vendredi de juillet",
    "Context": {
      "ReferenceDateTime": "2016-11-07T00:00:00"
    },
    "NotSupported": "python",
    "Results": [
      {
        "Text": "premier vendredi de juillet",
        "Type": "date",
        "Value": {
          "Timex": "XXXX-07-WXX-5-#1",
          "FutureResolution": {
            "date": "2017-07-07"
          },
          "PastResolution": {
            "date": "2016-07-01"
          }
        },
        "Start": 14,
        "Length": 27
      }
    ]
  },
  {
    "Input": "Je reviendrai premier vendredi de ce mois",
    "Context": {
      "ReferenceDateTime": "2016-11-07T00:00:00"
    },
    "NotSupported": "python",
    "Results": [
      {
        "Text": "premier vendredi de ce mois",
        "Type": "date",
        "Value": {
          "Timex": "XXXX-11-WXX-5-#1",
          "FutureResolution": {
            "date": "2016-11-04"
          },
          "PastResolution": {
            "date": "2016-11-04"
          }
        },
        "Start": 14,
        "Length": 27
      }
    ]
  },
  {
    "Input": "Je reviendrai vendredi la semaine prochain",
    "Context": {
      "ReferenceDateTime": "2016-11-07T00:00:00"
    },
    "NotSupported": "python",
    "Results": [
      {
        "Text": "vendredi la semaine prochain",
        "Type": "date",
        "Value": {
          "Timex": "2016-11-18",
          "FutureResolution": {
            "date": "2016-11-18"
          },
          "PastResolution": {
            "date": "2016-11-18"
          }
        },
        "Start": 14,
        "Length": 28
      }
    ]
  },
  {
    "Input": "Je reviendrai 12 Janvier, 2018",
    "Context": {
      "ReferenceDateTime": "2016-11-07T00:00:00"
    },
    "NotSupported": "python",
    "Results": [
      {
        "Text": "12 Janvier, 2018",
        "Type": "date",
        "Value": {
          "Timex": "2018-01-12",
          "FutureResolution": {
            "date": "2018-01-12"
          },
          "PastResolution": {
            "date": "2018-01-12"
          }
        },
        "Start": 14,
        "Length": 16
      }
    ]
  },
  {
    "Input": "Je reviendrai sur le    22/4",
    "Context": {
      "ReferenceDateTime": "2016-11-07T00:00:00"
    },
    "NotSupported": "python",
    "Results": [
      {
        "Text": "22/4",
        "Type": "date",
        "Value": {
          "Timex": "XXXX-04-22",
          "FutureResolution": {
            "date": "2017-04-22"
          },
          "PastResolution": {
            "date": "2016-04-22"
          }
        },
        "Start": 24,
        "Length": 4
      }
    ]
  },
  {
    "Input": "Je reviendrai 9-18-15",
    "Context": {
      "ReferenceDateTime": "2016-11-07T00:00:00"
    },
    "NotSupported": "python",
    "Results": [
      {
        "Text": "9-18-15",
        "Type": "date",
        "Value": {
          "Timex": "2015-09-18",
          "FutureResolution": {
            "date": "2015-09-18"
          },
          "PastResolution": {
            "date": "2015-09-18"
          }
        },
        "Start": 14,
        "Length": 7
      }
    ]
  },
  {
    "Input": "Je reviendrai 1 Janv",
    "Context": {
      "ReferenceDateTime": "2016-11-07T00:00:00"
    },
    "NotSupported": "python",
    "Results": [
      {
        "Text": "1 Janv",
        "Type": "date",
        "Value": {
          "Timex": "XXXX-01-01",
          "FutureResolution": {
            "date": "2017-01-01"
          },
          "PastResolution": {
            "date": "2016-01-01"
          }
        },
        "Start": 14,
        "Length": 6
      }
    ]
  },
  {
    "Input": "Je reviendrai mardi 22 janvier",
    "Context": {
      "ReferenceDateTime": "2016-11-07T00:00:00"
    },
    "NotSupported": "python",
    "Results": [
      {
        "Text": "mardi 22 janvier",
        "Type": "date",
        "Value": {
          "Timex": "XXXX-01-22",
          "FutureResolution": {
            "date": "2017-01-22"
          },
          "PastResolution": {
            "date": "2016-01-22"
          }
        },
        "Start": 14,
        "Length": 16
      }
    ]
  },
  {
    "Input": "Je reviendrai 1 Janv.",
    "Context": {
      "ReferenceDateTime": "2016-11-07T00:00:00"
    },
    "NotSupported": "python",
    "Results": [
      {
        "Text": "1 Janv",
        "Type": "date",
        "Value": {
          "Timex": "XXXX-01-01",
          "FutureResolution": {
            "date": "2017-01-01"
          },
          "PastResolution": {
            "date": "2016-01-01"
          }
        },
        "Start": 14,
        "Length": 6
      }
    ]
  },
  {
    "Input": "Je reviendrai 21 Mai",
    "Context": {
      "ReferenceDateTime": "2016-11-07T00:00:00"
    },
    "NotSupported": "python",
    "Results": [
      {
        "Text": "21 Mai",
        "Type": "date",
        "Value": {
          "Timex": "XXXX-05-21",
          "FutureResolution": {
            "date": "2017-05-21"
          },
          "PastResolution": {
            "date": "2016-05-21"
          }
        },
        "Start": 14,
        "Length": 6
      }
    ]
  },
  {
    "Input": "Je reviendrai Aout seconde",
    "Context": {
      "ReferenceDateTime": "2016-11-07T00:00:00"
    },
    "NotSupported": "python",
    "Results": [
      {
        "Text": "Aout seconde",
        "Type": "date",
        "Value": {
          "Timex": "XXXX-08-02",
          "FutureResolution": {
            "date": "2017-08-02"
          },
          "PastResolution": {
            "date": "2016-08-02"
          }
        },
        "Start": 14,
        "Length": 12
      }
    ]
  },
  {
    "Input": "Je reviendrai aout deuxieme",
    "Context": {
      "ReferenceDateTime": "2016-11-07T00:00:00"
    },
    "NotSupported": "python",
    "Results": [
      {
        "Text": "aout deuxieme",
        "Type": "date",
        "Value": {
          "Timex": "XXXX-08-02",
          "FutureResolution": {
            "date": "2017-08-02"
          },
          "PastResolution": {
            "date": "2016-08-02"
          }
        },
        "Start": 14,
        "Length": 13
      }
    ]
  },
  {
    "Input": "Je reviens vendredi",
    "Context": {
      "ReferenceDateTime": "2016-11-07T00:00:00"
    },
    "NotSupported": "python",
    "Results": [
      {
        "Text": "vendredi",
        "Type": "date",
        "Value": {
          "Timex": "XXXX-WXX-5",
          "FutureResolution": {
            "date": "2016-11-11"
          },
          "PastResolution": {
            "date": "2016-11-04"
          }
        },
        "Start": 11,
        "Length": 8
      }
    ]
  },
  {
    "Input": "Je reviens aujourd'hui",
    "Context": {
      "ReferenceDateTime": "2016-11-07T00:00:00"
    },
    "NotSupported": "python",
    "Results": [
      {
        "Text": "aujourd'hui",
        "Type": "date",
        "Value": {
          "Timex": "2016-11-07",
          "FutureResolution": {
            "date": "2016-11-07"
          },
          "PastResolution": {
            "date": "2016-11-07"
          }
        },
        "Start": 11,
        "Length": 11
      }
    ]
  },
  {
    "Input": "Je reviens demain",
    "Context": {
      "ReferenceDateTime": "2016-11-07T00:00:00"
    },
    "NotSupported": "python",
    "Results": [
      {
        "Text": "demain",
        "Type": "date",
        "Value": {
          "Timex": "2016-11-08",
          "FutureResolution": {
            "date": "2016-11-08"
          },
          "PastResolution": {
            "date": "2016-11-08"
          }
        },
        "Start": 11,
        "Length": 6
      }
    ]
  },
  {
    "Input": "Je vais revenier avant-hier",
    "Context": {
      "ReferenceDateTime": "2016-11-07T00:00:00"
    },
    "NotSupported": "python",
    "Results": [
      {
        "Text": "avant-hier",
        "Type": "date",
        "Value": {
          "Timex": "2016-11-05",
          "FutureResolution": {
            "date": "2016-11-05"
          },
          "PastResolution": {
            "date": "2016-11-05"
          }
        },
        "Start": 17,
        "Length": 10
      }
    ]
  },
  {
    "Input": "Je reviendrai demain",
    "Context": {
      "ReferenceDateTime": "2016-11-07T00:00:00"
    },
    "NotSupported": "python",
    "Results": [
      {
        "Text": "demain",
        "Type": "date",
        "Value": {
          "Timex": "2016-11-08",
          "FutureResolution": {
            "date": "2016-11-08"
          },
          "PastResolution": {
            "date": "2016-11-08"
          }
        },
        "Start": 14,
        "Length": 6
      }
    ]
  },
  {
    "Input": "Je reviendrai le lendemain",
    "Context": {
      "ReferenceDateTime": "2016-11-07T00:00:00"
    },
    "NotSupported": "python",
    "Results": [
      {
        "Text": "lendemain",
        "Type": "date",
        "Value": {
          "Timex": "2016-11-08",
          "FutureResolution": {
            "date": "2016-11-08"
          },
          "PastResolution": {
            "date": "2016-11-08"
          }
        },
        "Start": 17,
        "Length": 9
      }
    ]
  },
  {
    "Input": "Êtes-vous libre le 13.5.2015",
    "Context": {
      "ReferenceDateTime": "2017-03-22T00:00:00"
    },
    "NotSupported": "python",
    "Results": [
      {
        "Text": "13.5.2015",
        "Type": "date",
        "Value": {
          "Timex": "2015-05-13",
          "FutureResolution": {
            "date": "2015-05-13"
          },
          "PastResolution": {
            "date": "2015-05-13"
          }
        },
        "Start": 19,
        "Length": 9
      }
    ]
  },
  {
    "Input": "Êtes-vous libre le 2015.5.13",
    "Context": {
      "ReferenceDateTime": "2017-03-22T00:00:00"
    },
    "NotSupported": "python",
    "Results": [
      {
        "Text": "2015.5.13",
        "Type": "date",
        "Value": {
          "Timex": "2015-05-13",
          "FutureResolution": {
            "date": "2015-05-13"
          },
          "PastResolution": {
            "date": "2015-05-13"
          }
        },
        "Start": 19,
        "Length": 9
      }
    ]
  },
  {
    "Input": "Je reviendrai 3-7-2017",
    "Context": {
      "ReferenceDateTime": "2016-11-07T00:00:00"
    },
    "NotSupported": "python",
    "Results": [
      {
        "Text": "3-7-2017",
        "Type": "date",
        "Value": {
          "Timex": "2017-07-03",
          "FutureResolution": {
            "date": "2017-07-03"
          },
          "PastResolution": {
            "date": "2017-07-03"
          }
        },
        "Start": 14,
        "Length": 8
      }
    ]
  },
  {
    "Input": "Je reviendrai 3-7-07",
    "Context": {
      "ReferenceDateTime": "2016-11-07T00:00:00"
    },
    "NotSupported": "python",
    "Results": [
      {
        "Text": "3-7-07",
        "Type": "date",
        "Value": {
          "Timex": "2007-07-03",
          "FutureResolution": {
            "date": "2007-07-03"
          },
          "PastResolution": {
            "date": "2007-07-03"
          }
        },
        "Start": 14,
        "Length": 6
      }
    ]
  },
  {
    "Input": "Je reviendrai 3-7-27",
    "Context": {
      "ReferenceDateTime": "2016-11-07T00:00:00"
    },
    "NotSupported": "python",
    "Results": [
      {
        "Text": "3-7-27",
        "Type": "date",
        "Value": {
          "Timex": "2027-07-03",
          "FutureResolution": {
            "date": "2027-07-03"
          },
          "PastResolution": {
            "date": "2027-07-03"
          }
        },
        "Start": 14,
        "Length": 6
      }
    ]
  },
  {
    "Input": "Je reviendrai 05/05/89",
    "Context": {
      "ReferenceDateTime": "2016-11-07T00:00:00"
    },
    "NotSupported": "python",
    "Results": [
      {
        "Text": "05/05/89",
        "Type": "date",
        "Value": {
          "Timex": "1989-05-05",
          "FutureResolution": {
            "date": "1989-05-05"
          },
          "PastResolution": {
            "date": "1989-05-05"
          }
        },
        "Start": 14,
        "Length": 8
      }
    ]
  },
  {
    "Input": "Je reviendrai 05/05/71",
    "Context": {
      "ReferenceDateTime": "2016-11-07T00:00:00"
    },
    "NotSupported": "python",
    "Results": [
      {
        "Text": "05/05/71",
        "Type": "date",
        "Value": {
          "Timex": "1971-05-05",
          "FutureResolution": {
            "date": "1971-05-05"
          },
          "PastResolution": {
            "date": "1971-05-05"
          }
        },
        "Start": 14,
        "Length": 8
      }
    ]
  },
  {
    "Input": "Je reviendrai 1er avril 2005",
    "Context": {
      "ReferenceDateTime": "2016-09-07T00:00:00"
    },
    "NotSupported": "python",
    "Results": [
      {
        "Text": "1er avril 2005",
        "Type": "date",
        "Value": {
          "Timex": "2005-04-01",
          "FutureResolution": {
            "date": "2005-04-01"
          },
          "PastResolution": {
            "date": "2005-04-01"
          }
        },
        "Start": 14,
        "Length": 14
      }
    ]
  },
  {
    "Input": "Je reviendrai 1er avril 78",
    "Context": {
      "ReferenceDateTime": "2016-09-07T00:00:00"
    },
    "NotSupported": "python",
    "Results": [
      {
        "Text": "1er avril 78",
        "Type": "date",
        "Value": {
          "Timex": "1978-04-01",
          "FutureResolution": {
            "date": "1978-04-01"
          },
          "PastResolution": {
            "date": "1978-04-01"
          }
        },
        "Start": 14,
        "Length": 12
      }
    ]
  }
]