[
  {
    "Input": "Volvere el 15",
    "Context": {
      "ReferenceDateTime": "2016-11-07T00:00:00"
    },
    "Results": [
      {
        "Text": "15",
        "Type": "date",
        "Value": {
          "Timex": "XXXX-XX-15",
          "FutureResolution": {
            "date": "2016-11-15"
          },
          "PastResolution": {
            "date": "2016-10-15"
          }
        },
        "Start": 11,
        "Length": 2
      }
    ]
  },
  {
    "Input": "volvere el 2 Oct",
    "Context": {
      "ReferenceDateTime": "2016-11-07T00:00:00"
    },
    "Results": [
      {
        "Text": "2 Oct",
        "Type": "date",
        "Value": {
          "Timex": "XXXX-10-02",
          "FutureResolution": {
            "date": "2017-10-02"
          },
          "PastResolution": {
            "date": "2016-10-02"
          }
        },
        "Start": 11,
        "Length": 5
      }
    ]
  },
  {
    "Input": "volvere el 2-Oct",
    "Context": {
      "ReferenceDateTime": "2016-11-07T00:00:00"
    },
    "Results": [
      {
        "Text": "2-Oct",
        "Type": "date",
        "Value": {
          "Timex": "XXXX-10-02",
          "FutureResolution": {
            "date": "2017-10-02"
          },
          "PastResolution": {
            "date": "2016-10-02"
          }
        },
        "Start": 11,
        "Length": 5
      }
    ]
  },
  {
    "Input": "volvere el 2/Oct",
    "Context": {
      "ReferenceDateTime": "2016-11-07T00:00:00"
    },
    "Results": [
      {
        "Text": "2/Oct",
        "Type": "date",
        "Value": {
          "Timex": "XXXX-10-02",
          "FutureResolution": {
            "date": "2017-10-02"
          },
          "PastResolution": {
            "date": "2016-10-02"
          }
        },
        "Start": 11,
        "Length": 5
      }
    ]
  },
  {
    "Input": "volveré el 2 Octubre",
    "Context": {
      "ReferenceDateTime": "2016-11-07T00:00:00"
    },
    "Results": [
      {
        "Text": "2 Octubre",
        "Type": "date",
        "Value": {
          "Timex": "XXXX-10-02",
          "FutureResolution": {
            "date": "2017-10-02"
          },
          "PastResolution": {
            "date": "2016-10-02"
          }
        },
        "Start": 11,
        "Length": 9
      }
    ]
  },
  {
    "Input": "volveré el 12 de enero, 2016",
    "Context": {
      "ReferenceDateTime": "2016-11-07T00:00:00"
    },
    "Results": [
      {
        "Text": "12 de enero, 2016",
        "Type": "date",
        "Value": {
          "Timex": "2016-01-12",
          "FutureResolution": {
            "date": "2016-01-12"
          },
          "PastResolution": {
            "date": "2016-01-12"
          }
        },
        "Start": 11,
        "Length": 17
      }
    ]
  },
  {
    "Input": "volveré el lunes 12 de enero, 2016",
    "Context": {
      "ReferenceDateTime": "2016-11-07T00:00:00"
    },
    "Results": [
      {
        "Text": "lunes 12 de enero, 2016",
        "Type": "date",
        "Value": {
          "Timex": "2016-01-12",
          "FutureResolution": {
            "date": "2016-01-12"
          },
          "PastResolution": {
            "date": "2016-01-12"
          }
        },
        "Start": 11,
        "Length": 23
      }
    ]
  },
  {
    "Input": "volveré el 22/02/2016",
    "Context": {
      "ReferenceDateTime": "2016-11-07T00:00:00"
    },
    "Results": [
      {
        "Text": "22/02/2016",
        "Type": "date",
        "Value": {
          "Timex": "2016-02-22",
          "FutureResolution": {
            "date": "2016-02-22"
          },
          "PastResolution": {
            "date": "2016-02-22"
          }
        },
        "Start": 11,
        "Length": 10
      }
    ]
  },
  {
    "Input": "volveré el 21/04/2016",
    "Context": {
      "ReferenceDateTime": "2016-11-07T00:00:00"
    },
    "Results": [
      {
        "Text": "21/04/2016",
        "Type": "date",
        "Value": {
          "Timex": "2016-04-21",
          "FutureResolution": {
            "date": "2016-04-21"
          },
          "PastResolution": {
            "date": "2016-04-21"
          }
        },
        "Start": 11,
        "Length": 10
      }
    ]
  },
  {
    "Input": "volveré el 21/04/16",
    "Context": {
      "ReferenceDateTime": "2016-11-07T00:00:00"
    },
    "Results": [
      {
        "Text": "21/04/16",
        "Type": "date",
        "Value": {
          "Timex": "2016-04-21",
          "FutureResolution": {
            "date": "2016-04-21"
          },
          "PastResolution": {
            "date": "2016-04-21"
          }
        },
        "Start": 11,
        "Length": 8
      }
    ]
  },
  {
    "Input": "volveré el 21-04-2016",
    "Context": {
      "ReferenceDateTime": "2016-11-07T00:00:00"
    },
    "Results": [
      {
        "Text": "21-04-2016",
        "Type": "date",
        "Value": {
          "Timex": "2016-04-21",
          "FutureResolution": {
            "date": "2016-04-21"
          },
          "PastResolution": {
            "date": "2016-04-21"
          }
        },
        "Start": 11,
        "Length": 10
      }
    ]
  },
  {
    "Input": "volveré el 4.22",
    "Context": {
      "ReferenceDateTime": "2016-11-07T00:00:00"
    },
    "Results": [
      {
        "Text": "4.22",
        "Type": "date",
        "Value": {
          "Timex": "XXXX-04-22",
          "FutureResolution": {
            "date": "2017-04-22"
          },
          "PastResolution": {
            "date": "2016-04-22"
          }
        },
        "Start": 11,
        "Length": 4
      }
    ]
  },
  {
    "Input": "volveré el 4-22",
    "Context": {
      "ReferenceDateTime": "2016-11-07T00:00:00"
    },
    "Results": [
      {
        "Text": "4-22",
        "Type": "date",
        "Value": {
          "Timex": "XXXX-04-22",
          "FutureResolution": {
            "date": "2017-04-22"
          },
          "PastResolution": {
            "date": "2016-04-22"
          }
        },
        "Start": 11,
        "Length": 4
      }
    ]
  },
  {
    "Input": "volveré el     4/22",
    "Context": {
      "ReferenceDateTime": "2016-11-07T00:00:00"
    },
    "Results": [
      {
        "Text": "4/22",
        "Type": "date",
        "Value": {
          "Timex": "XXXX-04-22",
          "FutureResolution": {
            "date": "2017-04-22"
          },
          "PastResolution": {
            "date": "2016-04-22"
          }
        },
        "Start": 15,
        "Length": 4
      }
    ]
  },
  {
    "Input": "volveré el 22/04",
    "Context": {
      "ReferenceDateTime": "2016-11-07T00:00:00"
    },
    "Results": [
      {
        "Text": "22/04",
        "Type": "date",
        "Value": {
          "Timex": "XXXX-04-22",
          "FutureResolution": {
            "date": "2017-04-22"
          },
          "PastResolution": {
            "date": "2016-04-22"
          }
        },
        "Start": 11,
        "Length": 5
      }
    ]
  },
  {
    "Input": "volveré     4/22",
    "Context": {
      "ReferenceDateTime": "2016-11-07T00:00:00"
    },
    "Results": [
      {
        "Text": "4/22",
        "Type": "date",
        "Value": {
          "Timex": "XXXX-04-22",
          "FutureResolution": {
            "date": "2017-04-22"
          },
          "PastResolution": {
            "date": "2016-04-22"
          }
        },
        "Start": 12,
        "Length": 4
      }
    ]
  },
  {
    "Input": "volveré 22/04",
    "Context": {
      "ReferenceDateTime": "2016-11-07T00:00:00"
    },
    "Results": [
      {
        "Text": "22/04",
        "Type": "date",
        "Value": {
          "Timex": "XXXX-04-22",
          "FutureResolution": {
            "date": "2017-04-22"
          },
          "PastResolution": {
            "date": "2016-04-22"
          }
        },
        "Start": 8,
        "Length": 5
      }
    ]
  },
  {
    "Input": "volveré 2015/08/12",
    "Context": {
      "ReferenceDateTime": "2016-11-07T00:00:00"
    },
    "Results": [
      {
        "Text": "2015/08/12",
        "Type": "date",
        "Value": {
          "Timex": "2015-08-12",
          "FutureResolution": {
            "date": "2015-08-12"
          },
          "PastResolution": {
            "date": "2015-08-12"
          }
        },
        "Start": 8,
        "Length": 10
      }
    ]
  },
  {
    "Input": "volveré 08/12,2015",
    "Context": {
      "ReferenceDateTime": "2016-11-07T00:00:00"
    },
    "Results": [
      {
        "Text": "08/12,2015",
        "Type": "date",
        "Value": {
          "Timex": "2015-08-12",
          "FutureResolution": {
            "date": "2015-08-12"
          },
          "PastResolution": {
            "date": "2015-08-12"
          }
        },
        "Start": 8,
        "Length": 10
      }
    ]
  },
  {
    "Input": "volveré 08/12,15",
    "Context": {
      "ReferenceDateTime": "2016-11-07T00:00:00"
    },
    "Results": [
      {
        "Text": "08/12,15",
        "Type": "date",
        "Value": {
          "Timex": "2015-08-12",
          "FutureResolution": {
            "date": "2015-08-12"
          },
          "PastResolution": {
            "date": "2015-08-12"
          }
        },
        "Start": 8,
        "Length": 8
      }
    ]
  },
  {
    "Input": "volveré 1ro de Ene",
    "Context": {
      "ReferenceDateTime": "2016-11-07T00:00:00"
    },
    "Results": [
      {
        "Text": "1ro de Ene",
        "Type": "date",
        "Value": {
          "Timex": "XXXX-01-01",
          "FutureResolution": {
            "date": "2017-01-01"
          },
          "PastResolution": {
            "date": "2016-01-01"
          }
        },
        "Start": 8,
        "Length": 10
      }
    ]
  },
  {
    "Input": "volveré el 1-Ene",
    "Context": {
      "ReferenceDateTime": "2016-11-07T00:00:00"
    },
    "Results": [
      {
        "Text": "1-Ene",
        "Type": "date",
        "Value": {
          "Timex": "XXXX-01-01",
          "FutureResolution": {
            "date": "2017-01-01"
          },
          "PastResolution": {
            "date": "2016-01-01"
          }
        },
        "Start": 11,
        "Length": 5
      }
    ]
  },
  {
    "Input": "volveré el Mi, 22 de Ene",
    "Context": {
      "ReferenceDateTime": "2016-11-07T00:00:00"
    },
    "Results": [
      {
        "Text": "Mi, 22 de Ene",
        "Type": "date",
        "Value": {
          "Timex": "XXXX-01-22",
          "FutureResolution": {
            "date": "2017-01-22"
          },
          "PastResolution": {
            "date": "2016-01-22"
          }
        },
        "Start": 11,
        "Length": 13
      }
    ]
  },
  {
    "Input": "volveré el primero de Ene",
    "Context": {
      "ReferenceDateTime": "2016-11-07T00:00:00"
    },
    "Results": [
      {
        "Text": "primero de Ene",
        "Type": "date",
        "Value": {
          "Timex": "XXXX-01-01",
          "FutureResolution": {
            "date": "2017-01-01"
          },
          "PastResolution": {
            "date": "2016-01-01"
          }
        },
        "Start": 11,
        "Length": 14
      }
    ]
  },
  {
    "Input": "volveré el veintiuno de Mayo",
    "Context": {
      "ReferenceDateTime": "2016-11-07T00:00:00"
    },
    "Results": [
      {
        "Text": "veintiuno de Mayo",
        "Type": "date",
        "Value": {
          "Timex": "XXXX-05-21",
          "FutureResolution": {
            "date": "2017-05-21"
          },
          "PastResolution": {
            "date": "2016-05-21"
          }
        },
        "Start": 11,
        "Length": 17
      }
    ]
  },
  {
    "Input": "volveré en Mayo veintiuno",
    "Context": {
      "ReferenceDateTime": "2016-11-07T00:00:00"
    },
    "Results": [
      {
        "Text": "Mayo veintiuno",
        "Type": "date",
        "Value": {
          "Timex": "XXXX-05-21",
          "FutureResolution": {
            "date": "2017-05-21"
          },
          "PastResolution": {
            "date": "2016-05-21"
          }
        },
        "Start": 11,
        "Length": 14
      }
    ]
  },
  {
    "Input": "volveré el segundo de Ago.",
    "Context": {
      "ReferenceDateTime": "2016-11-07T00:00:00"
    },
    "Results": [
      {
        "Text": "segundo de Ago",
        "Type": "date",
        "Value": {
          "Timex": "XXXX-08-02",
          "FutureResolution": {
            "date": "2017-08-02"
          },
          "PastResolution": {
            "date": "2016-08-02"
          }
        },
        "Start": 11,
        "Length": 14
      }
    ]
  },
  {
    "Input": "volveré el vigesimo segundo de Junio",
    "Context": {
      "ReferenceDateTime": "2016-11-07T00:00:00"
    },
    "Results": [
      {
        "Text": "vigesimo segundo de Junio",
        "Type": "date",
        "Value": {
          "Timex": "XXXX-06-22",
          "FutureResolution": {
            "date": "2017-06-22"
          },
          "PastResolution": {
            "date": "2016-06-22"
          }
        },
        "Start": 11,
        "Length": 25
      }
    ]
  },
  {
    "Input": "volveré en viernes",
    "Context": {
      "ReferenceDateTime": "2016-11-07T00:00:00"
    },
    "Results": [
      {
        "Text": "viernes",
        "Type": "date",
        "Value": {
          "Timex": "XXXX-WXX-5",
          "FutureResolution": {
            "date": "2016-11-11"
          },
          "PastResolution": {
            "date": "2016-11-04"
          }
        },
        "Start": 11,
        "Length": 7
      }
    ]
  },
  {
    "Input": "volveré en |viernes",
    "Context": {
      "ReferenceDateTime": "2016-11-07T00:00:00"
    },
    "Results": [
      {
        "Text": "viernes",
        "Type": "date",
        "Value": {
          "Timex": "XXXX-WXX-5",
          "FutureResolution": {
            "date": "2016-11-11"
          },
          "PastResolution": {
            "date": "2016-11-04"
          }
        },
        "Start": 12,
        "Length": 7
      }
    ]
  },
  {
    "Input": "volveré los viernes",
    "Context": {
      "ReferenceDateTime": "2016-11-07T00:00:00"
    },
    "Results": [
      {
        "Text": "viernes",
        "Type": "date",
        "Value": {
          "Timex": "XXXX-WXX-5",
          "FutureResolution": {
            "date": "2016-11-11"
          },
          "PastResolution": {
            "date": "2016-11-04"
          }
        },
        "Start": 12,
        "Length": 7
      }
    ]
  },
  {
    "Input": "volveré |Viernes",
    "Context": {
      "ReferenceDateTime": "2016-11-07T00:00:00"
    },
    "Results": [
      {
        "Text": "Viernes",
        "Type": "date",
        "Value": {
          "Timex": "XXXX-WXX-5",
          "FutureResolution": {
            "date": "2016-11-11"
          },
          "PastResolution": {
            "date": "2016-11-04"
          }
        },
        "Start": 9,
        "Length": 7
      }
    ]
  },
  {
    "Input": "volveré hoy",
    "Context": {
      "ReferenceDateTime": "2016-11-07T00:00:00"
    },
    "Results": [
      {
        "Text": "hoy",
        "Type": "date",
        "Value": {
          "Timex": "2016-11-07",
          "FutureResolution": {
            "date": "2016-11-07"
          },
          "PastResolution": {
            "date": "2016-11-07"
          }
        },
        "Start": 8,
        "Length": 3
      }
    ]
  },
  {
    "Input": "volveré mañana",
    "Context": {
      "ReferenceDateTime": "2016-11-07T00:00:00"
    },
    "Results": [
      {
        "Text": "mañana",
        "Type": "date",
        "Value": {
          "Timex": "2016-11-08",
          "FutureResolution": {
            "date": "2016-11-08"
          },
          "PastResolution": {
            "date": "2016-11-08"
          }
        },
        "Start": 8,
        "Length": 6
      }
    ]
  },
  {
    "Input": "volví ayer",
    "Context": {
      "ReferenceDateTime": "2016-11-07T00:00:00"
    },
    "Results": [
      {
        "Text": "ayer",
        "Type": "date",
        "Value": {
          "Timex": "2016-11-06",
          "FutureResolution": {
            "date": "2016-11-06"
          },
          "PastResolution": {
            "date": "2016-11-06"
          }
        },
        "Start": 6,
        "Length": 4
      }
    ]
  },
  {
    "Input": "volví anteayer",
    "Context": {
      "ReferenceDateTime": "2016-11-07T00:00:00"
    },
    "Results": [
      {
        "Text": "anteayer",
        "Type": "date",
        "Value": {
          "Timex": "2016-11-05",
          "FutureResolution": {
            "date": "2016-11-05"
          },
          "PastResolution": {
            "date": "2016-11-05"
          }
        },
        "Start": 6,
        "Length": 8
      }
    ]
  },
  {
    "Input": "volveré pasado mañana",
    "Context": {
      "ReferenceDateTime": "2016-11-07T00:00:00"
    },
    "Results": [
      {
        "Text": "pasado mañana",
        "Type": "date",
        "Value": {
          "Timex": "2016-11-09",
          "FutureResolution": {
            "date": "2016-11-09"
          },
          "PastResolution": {
            "date": "2016-11-09"
          }
        },
        "Start": 8,
        "Length": 13
      }
    ]
  },
  {
    "Input": "volveré el día despues de mañana",
    "Context": {
      "ReferenceDateTime": "2016-11-07T00:00:00"
    },
    "Results": [
      {
        "Text": "el día despues de mañana",
        "Type": "date",
        "Value": {
          "Timex": "2016-11-09",
          "FutureResolution": {
            "date": "2016-11-09"
          },
          "PastResolution": {
            "date": "2016-11-09"
          }
        },
        "Start": 8,
        "Length": 24
      }
    ]
  },
  {
    "Input": "volveré el próximo dia",
    "Context": {
      "ReferenceDateTime": "2016-11-07T00:00:00"
    },
    "Results": [
      {
        "Text": "el próximo dia",
        "Type": "date",
        "Value": {
          "Timex": "2016-11-08",
          "FutureResolution": {
            "date": "2016-11-08"
          },
          "PastResolution": {
            "date": "2016-11-08"
          }
        },
        "Start": 8,
        "Length": 14
      }
    ]
  },
  {
    "Input": "volveré el día siguiente",
    "Context": {
      "ReferenceDateTime": "2016-11-07T00:00:00"
    },
    "Results": [
      {
        "Text": "el día siguiente",
        "Type": "date",
        "Value": {
          "Timex": "2016-11-08",
          "FutureResolution": {
            "date": "2016-11-08"
          },
          "PastResolution": {
            "date": "2016-11-08"
          }
        },
        "Start": 8,
        "Length": 16
      }
    ]
  },
  {
    "Input": "volveré el este viernes",
    "Context": {
      "ReferenceDateTime": "2016-11-07T00:00:00"
    },
    "Results": [
      {
        "Text": "este viernes",
        "Type": "date",
        "Value": {
          "Timex": "2016-11-11",
          "FutureResolution": {
            "date": "2016-11-11"
          },
          "PastResolution": {
            "date": "2016-11-11"
          }
        },
        "Start": 11,
        "Length": 12
      }
    ]
  },
  {
    "Input": "volveré el proximo domingo",
    "Context": {
      "ReferenceDateTime": "2016-11-07T00:00:00"
    },
    "Results": [
      {
        "Text": "proximo domingo",
        "Type": "date",
        "Value": {
          "Timex": "2016-11-20",
          "FutureResolution": {
            "date": "2016-11-20"
          },
          "PastResolution": {
            "date": "2016-11-20"
          }
        },
        "Start": 11,
        "Length": 15
      }
    ]
  },
  {
    "Input": "volveré el ultimo domingo",
    "Context": {
      "ReferenceDateTime": "2016-11-07T00:00:00"
    },
    "Results": [
      {
        "Text": "ultimo domingo",
        "Type": "date",
        "Value": {
          "Timex": "2016-11-06",
          "FutureResolution": {
            "date": "2016-11-06"
          },
          "PastResolution": {
            "date": "2016-11-06"
          }
        },
        "Start": 11,
        "Length": 14
      }
    ]
  },
  {
    "Input": "volveré el viernes de esta semana",
    "Context": {
      "ReferenceDateTime": "2016-11-07T00:00:00"
    },
    "Results": [
      {
        "Text": "viernes de esta semana",
        "Type": "date",
        "Value": {
          "Timex": "2016-11-11",
          "FutureResolution": {
            "date": "2016-11-11"
          },
          "PastResolution": {
            "date": "2016-11-11"
          }
        },
        "Start": 11,
        "Length": 22
      }
    ]
  },
  {
    "Input": "volveré el domingo de la siguiente semana",
    "Context": {
      "ReferenceDateTime": "2016-11-07T00:00:00"
    },
    "Results": [
      {
        "Text": "domingo de la siguiente semana",
        "Type": "date",
        "Value": {
          "Timex": "2016-11-20",
          "FutureResolution": {
            "date": "2016-11-20"
          },
          "PastResolution": {
            "date": "2016-11-20"
          }
        },
        "Start": 11,
        "Length": 30
      }
    ]
  },
  {
    "Input": "volveré el domingo de la última semana",
    "Context": {
      "ReferenceDateTime": "2016-11-07T00:00:00"
    },
    "Results": [
      {
        "Text": "domingo de la última semana",
        "Type": "date",
        "Value": {
          "Timex": "2016-11-06",
          "FutureResolution": {
            "date": "2016-11-06"
          },
          "PastResolution": {
            "date": "2016-11-06"
          }
        },
        "Start": 11,
        "Length": 27
      }
    ]
  },
  {
    "Input": "volveré el último dia",
    "Context": {
      "ReferenceDateTime": "2016-11-07T00:00:00"
    },
    "Results": [
      {
        "Text": "el último dia",
        "Type": "date",
        "Value": {
          "Timex": "2016-11-06",
          "FutureResolution": {
            "date": "2016-11-06"
          },
          "PastResolution": {
            "date": "2016-11-06"
          }
        },
        "Start": 8,
        "Length": 13
      }
    ]
  },
  {
    "Input": "volveré en el último día",
    "Context": {
      "ReferenceDateTime": "2016-11-07T00:00:00"
    },
    "Results": [
      {
        "Text": "el último día",
        "Type": "date",
        "Value": {
          "Timex": "2016-11-06",
          "FutureResolution": {
            "date": "2016-11-06"
          },
          "PastResolution": {
            "date": "2016-11-06"
          }
        },
        "Start": 11,
        "Length": 13
      }
    ]
  },
  {
    "Input": "volveré en el día",
    "Context": {
      "ReferenceDateTime": "2016-11-07T00:00:00"
    },
    "Results": [
      {
        "Text": "el día",
        "Type": "date",
        "Value": {
          "Timex": "2016-11-07",
          "FutureResolution": {
            "date": "2016-11-07"
          },
          "PastResolution": {
            "date": "2016-11-07"
          }
        },
        "Start": 11,
        "Length": 6
      }
    ]
  },
  {
    "Input": "volveré el 15 Junio 2016",
    "Context": {
      "ReferenceDateTime": "2016-11-07T00:00:00"
    },
    "Results": [
      {
        "Text": "15 Junio 2016",
        "Type": "date",
        "Value": {
          "Timex": "2016-06-15",
          "FutureResolution": {
            "date": "2016-06-15"
          },
          "PastResolution": {
            "date": "2016-06-15"
          }
        },
        "Start": 11,
        "Length": 13
      }
    ]
  },
  {
    "Input": "volveré el primer viernes de julio",
    "Context": {
      "ReferenceDateTime": "2016-11-07T00:00:00"
    },
    "Results": [
      {
        "Text": "el primer viernes de julio",
        "Type": "date",
        "Value": {
          "Timex": "XXXX-07-WXX-5-#1",
          "FutureResolution": {
            "date": "2017-07-07"
          },
          "PastResolution": {
            "date": "2016-07-01"
          }
        },
        "Start": 8,
        "Length": 26
      }
    ]
  },
  {
    "Input": "volveré el primer viernes de este mes",
    "Context": {
      "ReferenceDateTime": "2016-11-07T00:00:00"
    },
    "Results": [
      {
        "Text": "el primer viernes de este mes",
        "Type": "date",
        "Value": {
          "Timex": "XXXX-11-WXX-5-#1",
          "FutureResolution": {
            "date": "2016-11-04"
          },
          "PastResolution": {
            "date": "2016-11-04"
          }
        },
        "Start": 8,
        "Length": 29
      }
    ]
  },
  {
    "Input": "volveré el 12 de enero, 2018",
    "Context": {
      "ReferenceDateTime": "2016-11-07T00:00:00"
    },
    "Results": [
      {
        "Text": "12 de enero, 2018",
        "Type": "date",
        "Value": {
          "Timex": "2018-01-12",
          "FutureResolution": {
            "date": "2018-01-12"
          },
          "PastResolution": {
            "date": "2018-01-12"
          }
        },
        "Start": 11,
        "Length": 17
      }
    ]
  },
  {
    "Input": "volveré el 9-18-15",
    "Context": {
      "ReferenceDateTime": "2016-11-07T00:00:00"
    },
    "Results": [
      {
        "Text": "9-18-15",
        "Type": "date",
        "Value": {
          "Timex": "2015-09-18",
          "FutureResolution": {
            "date": "2015-09-18"
          },
          "PastResolution": {
            "date": "2015-09-18"
          }
        },
        "Start": 11,
        "Length": 7
      }
    ]
  },
  {
    "Input": "volveré el 2015/08/12",
    "Context": {
      "ReferenceDateTime": "2016-11-07T00:00:00"
    },
    "Results": [
      {
        "Text": "2015/08/12",
        "Type": "date",
        "Value": {
          "Timex": "2015-08-12",
          "FutureResolution": {
            "date": "2015-08-12"
          },
          "PastResolution": {
            "date": "2015-08-12"
          }
        },
        "Start": 11,
        "Length": 10
      }
    ]
  },
  {
    "Input": "volveré el 08/12,2015",
    "Context": {
      "ReferenceDateTime": "2016-11-07T00:00:00"
    },
    "Results": [
      {
        "Text": "08/12,2015",
        "Type": "date",
        "Value": {
          "Timex": "2015-08-12",
          "FutureResolution": {
            "date": "2015-08-12"
          },
          "PastResolution": {
            "date": "2015-08-12"
          }
        },
        "Start": 11,
        "Length": 10
      }
    ]
  },
  {
    "Input": "volveré el 1ro de Ene",
    "Context": {
      "ReferenceDateTime": "2016-11-07T00:00:00"
    },
    "Results": [
      {
        "Text": "1ro de Ene",
        "Type": "date",
        "Value": {
          "Timex": "XXXX-01-01",
          "FutureResolution": {
            "date": "2017-01-01"
          },
          "PastResolution": {
            "date": "2016-01-01"
          }
        },
        "Start": 11,
        "Length": 10
      }
    ]
  },
  {
    "Input": "Volveré el primero de Ene",
    "Context": {
      "ReferenceDateTime": "2016-11-07T00:00:00"
    },
    "Results": [
      {
        "Text": "primero de Ene",
        "Type": "date",
        "Value": {
          "Timex": "XXXX-01-01",
          "FutureResolution": {
            "date": "2017-01-01"
          },
          "PastResolution": {
            "date": "2016-01-01"
          }
        },
        "Start": 11,
        "Length": 14
      }
    ]
  },
  {
    "Input": "Volveré el veintiuno de Mayo",
    "Context": {
      "ReferenceDateTime": "2016-11-07T00:00:00"
    },
    "Results": [
      {
        "Text": "veintiuno de Mayo",
        "Type": "date",
        "Value": {
          "Timex": "XXXX-05-21",
          "FutureResolution": {
            "date": "2017-05-21"
          },
          "PastResolution": {
            "date": "2016-05-21"
          }
        },
        "Start": 11,
        "Length": 17
      }
    ]
  },
  {
    "Input": "Volveré el Mayo veintiuno",
    "Context": {
      "ReferenceDateTime": "2016-11-07T00:00:00"
    },
    "Results": [
      {
        "Text": "Mayo veintiuno",
        "Type": "date",
        "Value": {
          "Timex": "XXXX-05-21",
          "FutureResolution": {
            "date": "2017-05-21"
          },
          "PastResolution": {
            "date": "2016-05-21"
          }
        },
        "Start": 11,
        "Length": 14
      }
    ]
  },
  {
    "Input": "Volveré el segundo de Ago.",
    "Context": {
      "ReferenceDateTime": "2016-11-07T00:00:00"
    },
    "Results": [
      {
        "Text": "segundo de Ago",
        "Type": "date",
        "Value": {
          "Timex": "XXXX-08-02",
          "FutureResolution": {
            "date": "2017-08-02"
          },
          "PastResolution": {
            "date": "2016-08-02"
          }
        },
        "Start": 11,
        "Length": 14
      }
    ]
  },
  {
    "Input": "Volveré el vigesimo segundo de Junio",
    "Context": {
      "ReferenceDateTime": "2016-11-07T00:00:00"
    },
    "Results": [
      {
        "Text": "vigesimo segundo de Junio",
        "Type": "date",
        "Value": {
          "Timex": "XXXX-06-22",
          "FutureResolution": {
            "date": "2017-06-22"
          },
          "PastResolution": {
            "date": "2016-06-22"
          }
        },
        "Start": 11,
        "Length": 25
      }
    ]
  },
  {
    "Input": "Volveré el viernes",
    "Context": {
      "ReferenceDateTime": "2016-11-07T00:00:00"
    },
    "Results": [
      {
        "Text": "viernes",
        "Type": "date",
        "Value": {
          "Timex": "XXXX-WXX-5",
          "FutureResolution": {
            "date": "2016-11-11"
          },
          "PastResolution": {
            "date": "2016-11-04"
          }
        },
        "Start": 11,
        "Length": 7
      }
    ]
  },
  {
    "Input": "Volvi el dia antes de ayer",
    "Context": {
      "ReferenceDateTime": "2016-11-07T00:00:00"
    },
    "Results": [
      {
        "Text": "el dia antes de ayer",
        "Type": "date",
        "Value": {
          "Timex": "2016-11-05",
          "FutureResolution": {
            "date": "2016-11-05"
          },
          "PastResolution": {
            "date": "2016-11-05"
          }
        },
        "Start": 6,
        "Length": 20
      }
    ]
  },
  {
    "Input": "Volveré pasado mañana",
    "Context": {
      "ReferenceDateTime": "2016-11-07T00:00:00"
    },
    "Results": [
      {
        "Text": "pasado mañana",
        "Type": "date",
        "Value": {
          "Timex": "2016-11-09",
          "FutureResolution": {
            "date": "2016-11-09"
          },
          "PastResolution": {
            "date": "2016-11-09"
          }
        },
        "Start": 8,
        "Length": 13
      }
    ]
  },
  {
    "Input": "El día despues de mañana",
    "Context": {
      "ReferenceDateTime": "2016-11-07T00:00:00"
    },
    "Results": [
      {
        "Text": "El día despues de mañana",
        "Type": "date",
        "Value": {
          "Timex": "2016-11-09",
          "FutureResolution": {
            "date": "2016-11-09"
          },
          "PastResolution": {
            "date": "2016-11-09"
          }
        },
        "Start": 0,
        "Length": 24
      }
    ]
  },
  {
    "Input": "volveré el proximo día",
    "Context": {
      "ReferenceDateTime": "2016-11-07T00:00:00"
    },
    "Results": [
      {
        "Text": "el proximo día",
        "Type": "date",
        "Value": {
          "Timex": "2016-11-08",
          "FutureResolution": {
            "date": "2016-11-08"
          },
          "PastResolution": {
            "date": "2016-11-08"
          }
        },
        "Start": 8,
        "Length": 14
      }
    ]
  },
  {
    "Input": "volveré el próximo domingo",
    "Context": {
      "ReferenceDateTime": "2016-11-07T00:00:00"
    },
    "Results": [
      {
        "Text": "próximo domingo",
        "Type": "date",
        "Value": {
          "Timex": "2016-11-20",
          "FutureResolution": {
            "date": "2016-11-20"
          },
          "PastResolution": {
            "date": "2016-11-20"
          }
        },
        "Start": 11,
        "Length": 15
      }
    ]
  },
  {
    "Input": "volveré el 3-7-2017",
    "Context": {
      "ReferenceDateTime": "2016-11-07T00:00:00"
    },
    "Results": [
      {
        "Text": "3-7-2017",
        "Type": "date",
        "Value": {
          "Timex": "2017-07-03",
          "FutureResolution": {
            "date": "2017-07-03"
          },
          "PastResolution": {
            "date": "2017-07-03"
          }
        },
        "Start": 11,
        "Length": 8
      }
    ]
  },
  {
    "Input": "¿Estás libre el 13.5.2015",
    "Context": {
      "ReferenceDateTime": "2016-11-07T00:00:00"
    },
    "Results": [
      {
        "Text": "13.5.2015",
        "Type": "date",
        "Value": {
          "Timex": "2015-05-13",
          "FutureResolution": {
            "date": "2015-05-13"
          },
          "PastResolution": {
            "date": "2015-05-13"
          }
        },
        "Start": 16,
        "Length": 9
      }
    ]
  },
  {
    "Input": "¿Estás libre el 2015.5.13",
    "Context": {
      "ReferenceDateTime": "2016-11-07T00:00:00"
    },
    "Results": [
      {
        "Text": "2015.5.13",
        "Type": "date",
        "Value": {
          "Timex": "2015-05-13",
          "FutureResolution": {
            "date": "2015-05-13"
          },
          "PastResolution": {
            "date": "2015-05-13"
          }
        },
        "Start": 16,
        "Length": 9
      }
    ]
  },
  {
    "Input": "volveré el 3-7-07",
    "Context": {
      "ReferenceDateTime": "2016-11-07T00:00:00"
    },
    "Results": [
      {
        "Text": "3-7-07",
        "Type": "date",
        "Value": {
          "Timex": "2007-07-03",
          "FutureResolution": {
            "date": "2007-07-03"
          },
          "PastResolution": {
            "date": "2007-07-03"
          }
        },
        "Start": 11,
        "Length": 6
      }
    ]
  },
  {
    "Input": "volveré el 3-7-27",
    "Context": {
      "ReferenceDateTime": "2016-11-07T00:00:00"
    },
    "Results": [
      {
        "Text": "3-7-27",
        "Type": "date",
        "Value": {
          "Timex": "2027-07-03",
          "FutureResolution": {
            "date": "2027-07-03"
          },
          "PastResolution": {
            "date": "2027-07-03"
          }
        },
        "Start": 11,
        "Length": 6
      }
    ]
  },
  {
    "Input": "volveré el 05/05/89",
    "Context": {
      "ReferenceDateTime": "2016-11-07T00:00:00"
    },
    "Results": [
      {
        "Text": "05/05/89",
        "Type": "date",
        "Value": {
          "Timex": "1989-05-05",
          "FutureResolution": {
            "date": "1989-05-05"
          },
          "PastResolution": {
            "date": "1989-05-05"
          }
        },
        "Start": 11,
        "Length": 8
      }
    ]
  },
  {
    "Input": "volveré el 05/05/71",
    "Context": {
      "ReferenceDateTime": "2016-11-07T00:00:00"
    },
    "Results": [
      {
        "Text": "05/05/71",
        "Type": "date",
        "Value": {
          "Timex": "1971-05-05",
          "FutureResolution": {
            "date": "1971-05-05"
          },
          "PastResolution": {
            "date": "1971-05-05"
          }
        },
        "Start": 11,
        "Length": 8
      }
    ]
  }
]